Policy Area,Need Group,Agency,Type,Need,Request
,,,,,"Enhance park safety through design interventions, e.g. better lighting "
,,,,,Enhance park safety through more security staff (police or parks enforcement)
,,,,,Improve trash removal and cleanliness
,,,,,New equipment for maintenance
,,,,,New equipment for maintenance 
,,,,,Other expense budget request for DPR
,,,,,Other park maintenance and safety requests
,,,,,Provide better park maintenance
,,,,,Improve the quality/staffing of existing programs offered in parks or recreational centers
,,,,,Other park programming requests
,,,,,"Provide more athletic programming (i.e. league, aquatic)"
,,,,,Provide more educational programming in Computer Resource Center
,,,,,Provide more environmental education programming (i.e. Urban Park Rangers)
,,,,,Provide more programs in parks or recreational centers
,,,,,Provide new type and/or specific type of program
,,,,,Improve access to a building in a park
,,,,,"Improve access to a park or amenity (i.e. playground, outdoor athletic field)"
,,,,,Other capital budget request for DPR
,,,,,"Other requests for park, building, or access improvements"
,,,,,"Provide a new or expanded park or amenity (i.e. playground, outdoor athletic field)"
,,,,,"Provide a new, or new expansion to, a building in a park"
,,,,,Reconstruct or upgrade a building in a park
,,,,,"Reconstruct or upgrade a park or amenity (i.e. playground, outdoor athletic field)"
,,,,,"Forestry services, including street tree maintenance"
,,,,,Other street trees and forestry services requests
,,,,,Plant new street trees
,,,,,Other cultural facilities and resources requests
,,,,,Other cultural facilities and resources requests 
,,,,,Provide more public art
,,,,,Purchase equipment for cultural facility
,,,,,Renovate or upgrade an existing cultural facility
,,,,,Support nonprofit cultural organizations
,,,,,Other expense budget request for DCLA
,,,,,Expand staffing and program related services
,,,,,Other staffing and program related requests
,,,,,Other expense budget request for LPC
,,,,,"Create a new, or renovate or upgrade an existing public library"
,,,,,Extend library hours or expand and enhance library programs
,,,,,Provide more or better equipment to a library
,,,,,"Extend library hours, expand library programs, and enhance library collections"
,,,,,"Provide new or replacement equipment to a library, including technology"
,,,,,Other capital budget request for NYPL
,,,,,Other expense budget request for NYPL
,,,,,Maintain library hours and/or days of service
,,,,,Other expense budget request for QPL
,,,,,Other expense budget request for QL
,,,,,"Renovate, upgrade or provide new community board facilities and equipment"
,,,,,Other capital budget request for DCAS
,,,,,Other community board facilities and staff requests
,,,,,Provide more community board staff
,,,,,Information technology goods and services
,,,,,Telecommunications related requests
,,,,,Other expense budget request for DoiTT
,,,,,Other expense request for NYCEM
,,,,,Other capital request for NYCEM
,,,,,Other expense budget request for DCA
,,,,,Other capital budget request for MOCJ
,,,,,Other expense budget request for MOCJ
,,,,,Other expense budget request for MOME
,,,,,Other expense budget request for CECM
,,,,,Other capital request
,,,,,Other expense request