Policy Area,Need Group,Agency,Type,Need,Request
Health Care and Human Services,Needs for Older NYs,Department for the Aging (DFTA),Capital,Facilities for seniors,Renovate or upgrade a senior center
"Youth, Education, and Child Welfare",Needs for Health Care and Facilities,Department of Health and Mental Hygiene (DOHMH),Expense,Services for homebound older adults,Other capital budget request for DFTA
Public Safety and Emergency Services,Needs for Homeless,Health and Hospitals Corporation (HHC),,Elder abuse programs,Continue Crime Prevention/Victim Assistance Program for Seniors
"Core Infrastructure, City Services, and Resiliency",Needs for Low Income NYs,Department for Homeless Services (DHS),,Naturally Occurring Retirement Community (NORC) programs,Enhance programs for elder abuse victims
"Housing, Economic Development, and Land Use",Needs for Youth Education,Human Resources Administration (HRA),,Senior center programs,Enhance NORC programs and health services
Transportation and Mobility,Needs for Youth and Child Welfare,Department of Education (DOE),,Other needs,Enhance educational and recreational programs
"Parks, Cultural, and Other Community Facilities",Needs for Public Safety,School Construction Authority,,Animal and pest control services,Funding for a new senior center program
Other Needs,Needs for Emergency Services,Administration for Children's Services (ACS),,Developmental delays programs ,Other senior center program requests
,"Needs for Water, Sewers, and Environmental Protection",Department of Youth and Community Development (DYCD),,Health and safety inspections ,Provide additional senior center staffing
,Needs for Sanitation Services,New York Police Department (NYPD),,Healthy homes programs ,Allocate funds for outreach services to homebound older adults and for programs that allow the elderly to age in place
,Needs for Land Use,Fire Department of New York (FDNY),,Healthy lifestyles programs,Enhance home care services
,Needs for Housing,Department of Environmental Protection (DEP),,Mental health programs ,Increase case management capacity
,Needs for Economic Development,Department of Sanitation (DSNY),,Programs to address other infectious diseases,Increase home delivered meals capacity
,Needs for Traffic and Transportation Infrastructure,Department of City Planning (DCP),,Programs to address other public health issues,Increase programmatic funding to Friendly Visiting Programs
,Needs for Transit Services,Department of Buildings (DOB),,Programs to address HIV/AIDS or other infectious diseases,Increase staffing for homebound adult programs
,Needs for Parks,Housing Preservation and Development (HPD),,Substance misuse prevention programs,Increase transportation services capacity
,Needs for Cultural Services,New York City Housing Authority (NYCHA),,Health care facilities,Other expense budget request for DFTA
,Needs for Library Services,Economic Development Corporation (EDC),,Facilities for the homeless,Other capital budget request for DOHMH
,Needs for Community Boards,Department of Small Business Services (SBS),,Services for the homeless,Animal and pest control requests including reducing rat and mosquito populations
,Other,Department of Transportation (DOT),,Assistance for persons living with clinically symptomatic HIV or AIDS,Create or promote programs to destigmatize developmental delays and encourage treatment
,,New York City Transit Authority (NYCTA),,Domestic violence services,"Increase health and safety inspections, e.g. for restaurants and childcare programs"
,,Taxi and Limousine Commission (TLC),,Homelessness prevention programs,Create or promote programs to decrease children’s emergency department visits for asthma and prevent injuries
,,Department of Parks and Recreation (DPR),,Services for vulnerable New Yorkers,"Create or promote programs for education and awareness on preventing chronic diseases including quitting smoking, nutrition, physical activity, etc."
,,Department of Cultural Affairs (DCLA),,Services to support low-income New Yorkers,Create or promote programs to de-stigmatize mental health needs and encourage treatment
,,Landmarks Preservation Commission (LPC),,Early care and educational programs,Provide more information and services for non-vaccine preventable illnesses
,,Brooklyn Public Library (BPL),,Educational programs,Other programs to address public health issues requests
,,New York Public Library (NYPL),,Schools and educational facilities,"Provide more information and services related to STIs, HIV/AIDS, and family planning"
,,Queens Library (QL),,Agency-wide,Provide more tuberculosis information and services
,,Department of Citywide Administrative Services (DCAS),,Child and family well-being,Promote vaccinations and immunizations
,,Office of Management and Budget (OMB),,Child protection and child welfare,Create or promote programs to de-stigmatize substance misuse and encourage treatment
,,Department of Information Technology and Telecommunications (DOITT),,Foster care and child welfare,Provide a new or expanded health care facility
,,NYC Emergency Management (NYCEM),,Juvenile justice programs,Renovate or upgrade an existing health care facility
,,Department of Consumer and Worker Protection (DCWP),,Preventive and child welfare,Replace or upgrade information technology equipment
,,Mayor's Office of Criminal Justice (MOCJ),,After school programs,Replace or upgrade medical/clinical equipment
,,Mayor's Office of Media and Entertainment (MOME),,Literacy programs,Other Capital health care facilities request
,,Mayor's Office of Citywide Event Coordination and Management (CECM),,Programs for non-custodial fathers,Other expense budget request for HHC
,,Other,,Runaway and homeless youth,Provide new homeless shelters or SROs
,,,,Services for immigrants and immigrant families,Upgrade existing facilities for the homeless
,,,,Youth workforce development,Other facilities for homeless requests
,,,,NYPD facilities and equipment,Other capital budget request for DHS
,,,,NYPD programs,Expand street outreach
,,,,NYPD staff and training resources,Improve safety at homeless shelters
,,,,FDNY facilities and equipment,Other request for services for the homeless
,,,,FDNY programs and staffing,Provide programs for homeless veterans
,,,,Environmental protection,"Provide case management, cash assistance, or social services"
,,,,Sewage and flooding,Other domestic violence services requests
,,,,Wastewater treatment system,Provide emergency shelter for domestic violence victims
,,,,Water supply system,"Provide social services for domestic violence survivors (legal services, counseling, referral to supportive services, etc.)"
,,,,Garbage collection and recycling,Other homelessness prevention program request
,,,,Garbage collection and recycling infrastructure,"Provide, expand, or enhance homeless prevention programs/anti-eviction legal services"
,,,,Sanitation enforcement,"Provide, expand, or enhance rental assistance programs/vouchers for permanent housing"
,,,,Snow removal,Assist low income households in paying for energy costs
,,,,Cleaning,"Expand, or enhance Emergency Food Assistance Program (EFAP)"
,,,,Zoning and land use,Improve the delivery of emergency food and shelter in case of a disaster
,,,,Building code and zoning enforcement,Other request for services for vulnerable New Yorkers
,,,,Affordable housing programs,"Provide, expand, or enhance adult protective services"
,,,,Housing oversight and emergency housing programs,"Provide, expand, or enhance in-home medical and non-medical care"
,,,,Housing support,Enhance cash assistance programs
,,,,"Public housing maintenance, staffing and management",Expand access to public health insurance such as Medicaid
,,,,Public housing upgrades or renovations,Other request for services to support low-income New Yorkers
,,,,Economic development investments,Provide Metrocards to help low-income New Yorkers get to work and around the City
,,,,Economic development programs,"Provide, expand, or enhance educational programs for adults"
,,,,Tax and other incentives programs and financing support,"Provide, expand, or enhance Fair Fares"
,,,,Business regulatory assistance,"Provide, expand, or enhance food assistance, such as Food Stamps / SNAP"
,,,,Commercial district revitalization,"Provide, expand, or enhance job search and placement support"
,,,,Direct business services,"Provide, expand, or enhance job training"
,,,,Workforce development,Other capital budget request for HRA
,,,,Ferries,Other expense budget request for HRA
,,,,Traffic and traffic flow,"Provide, expand, or enhance funding for Child Care and Head Start programs"
,,,,Transportation infrastructure,"Assign more non-teaching staff, e.g., to provide social, health and other services"
,,,,Transit Infrastructure,Assign more teaching staff
,,,,Transit service,"Expand or improve nutritional programs, e.g., school meals"
,,,,Other transit needs,Other educational programs requests
,,,,Park maintenance and safety,Provide more funds for teaching resources such as classroom material
,,,,Park programming,Other capital budget request for DOE
,,,,"Park, buildings, and access improvements",Other expense budget request for DOE
,,,,Street trees and forestry services,Provide a new or expand an existing elementary school
,,,,Cultural facilities and resources,Provide a new or expand an existing high school
,,,,Landmarks and preservation,Provide a new or expand an existing middle/intermediate school
,,,,"Library facilities, equipment and programs",Provide technology upgrade
,,,,Community board facilities and staff,Renovate exterior building component
,,,,"Information technology hardware, software or services",Renovate interior building component
,,,,Emergency Management,Renovate or upgrade a high school
,,,,Consumer and worker protection,Renovate or upgrade a middle or intermediate school
,,,,Criminal justice,Renovate or upgrade an elementary school
,,,,Media and entertainment,Renovate other site component
,,,,Other Capital Needs,Increase staff recruitment and retention
,,,,Other Expense Needs,"Provide, expand, or enhance training opportunities for staff"
,,,,,"Renovate, upgrade, or expand ACS sites that provide services to children, youth and families"
,,,,,"Provide, expand, or enhance primary prevention services to strengthen families"
,,,,,Increase support for child protection staff
,,,,,Increase kinship foster care placements and support for foster parents
,,,,,Other foster care and child welfare requests
,,,,,"Provide, expand, or enhance funding to support higher education and/or workforce development opportunities for youth who are leaving foster care"
,,,,,"Provide, expand, or enhance housing assistance for youth that are leaving foster care"
,,,,,Increase support for juvenile justice staff
,,,,,"Provide, expand, or enhance preventive services and community based alternatives for youth"
,,,,,"Provide, expand, or enhance programming for Close to Home residential programs and/or juvenile detention sites"
,,,,,"Provide, expand, or enhance child welfare preventive services"
,,,,,Other expense budget request for ACS
,,,,,"Provide, expand, or enhance after school programs for elementary school students (grades K-5)"
,,,,,"Provide, expand, or enhance after school programs for middle school students (grades 6-8)"
,,,,,"Provide, expand, or enhance Cornerstone and Beacon programs (all ages, including young adults)"
,,,,,"Provide, expand, or enhance adolescent literacy programs and services"
,,,,,"Provide, expand, or enhance adult literacy programs services"
,,,,,"Provide, expand, or enhance fatherhood programs for non-custodial fathers, e.g. parenting skills training"
,,,,,Other runaway and homeless youth requests
,,,,,"Provide, expand, or enhance drop-in center services"
,,,,,"Provide, expand, or enhance residential services"
,,,,,"Provide, expand, or enhance street outreach services"
,,,,,Other services for immigrants and immigrant families requests
,,,,,"Provide, expand, or enhance English for speakers of other languages (ESOL) services"
,,,,,Other youth workforce development requests
,,,,,"Provide, expand, or enhance skills training and employment services for high school students at risk of dropping out"
,,,,,"Provide, expand, or enhance the out-of-school youth program for job training and employment services"
,,,,,"Provide, expand, or enhance the Summer Youth Employment Program"
,,,,,"Provide, expand, or enhance the Young Adult Internship Program"
,,,,,Other expense budget request for DYCD
,,,,,Other capital budget request for DYCD
,,,,,Add NYPD parking facilities
,,,,,Other NYPD facilities and equipment requests
,,,,,Other NYPD facilities and equipment requests 
,,,,,"Provide a new NYPD facility, such as a new precinct house or sub-precinct"
,,,,,Provide additional patrol cars and other vehicles
,,,,,Provide additional ShotSpotter coverage
,,,,,Provide surveillance (Argus) cameras
,,,,,Renovate or upgrade existing precinct houses
,,,,,Upgrade the emergency response system
,,,,,Increase resources for domestic violence prevention programs
,,,,,Increase resources for other crime prevention programs
,,,,,"Increase resources for vandalism prevention programs, such as anti-graffiti initiatives"
,,,,,Increase resources for youth crime prevention programs
,,,,,Other NYPD programs requests
,,,,,Hire additional community affairs officers
,,,,,Hire additional crossing guards
,,,,,Hire additional housing police officers
,,,,,Hire additional school safety agents
,,,,,"Hire additional staff to address specific crimes (e.g. drug, gang-related, vice, etc.)"
,,,,,Hire additional traffic enforcement agents
,,,,,Hire additional transit police officers
,,,,,Hire additional uniformed officers
,,,,,Other NYPD staff resources requests
,,,,,"Provide resources to train officers, e.g. in community policing"
,,,,,Other FDNY facilities and equipment requests
,,,,,"Provide new emergency vehicles, such as fire trucks or ambulances"
,,,,,Provide new facilities such as a firehouse or EMS station
,,,,,Rehabilitate or renovate existing fire houses or EMS stations
,,,,,Upgrade communication equipment to improve emergency response
,,,,,Expand funding for fire prevention and life safety initiatives
,,,,,Provide more firefighters or EMS workers
,,,,,Other expense budget request for FDNY
,,,,,Other capital budget request for FDNY
,,,,,Investigate air quality complaints at specific location
,,,,,Investigate and address a hazardous materials complaint at a specific address/location
,,,,,Investigate noise complaints at specific location
,,,,,Request investigation of asbestos abatement work at specific location/address
,,,,,Clean catch basins
,,,,,Develop a capital project for specific street segments currently lacking sanitary sewers
,,,,,"Evaluate a public location or property for green infrastructure, e.g. rain gardens, stormwater greenstreets, green playgrounds"
,,,,,"Evaluate a street segment or intersection for green infrastructure, e.g. rain gardens, stormwater greenstreets, and plan for construction if feasible"
,,,,,Inspect sanitary sewer on specific street segment and repair or replace as needed
,,,,,"Inspect storm sewer on specific street segment and service, repair or replace as needed"
,,,,,Move a planned capital project into the budget for the next fiscal year
,,,,,Investigate complaints about wastewater facility effluent or overflow and address/repair or make equipment improvements as needed
,,,,,Investigate odor complaints about a wastewater facility and address/repair or make equipment improvements as needed
,,,,,Inspect fire hydrant at a specific location and repair or replace as needed
,,,,,Inspect water main on specific street segment and repair or replace as needed
,,,,,Investigate and address water pressure complaint at specific address or on specific street segment
,,,,,Investigate and address water quality complaints at an address or on specific street segments
,,,,,Other capital budget request for DEP
,,,,,Other expense budget request for DEP
,,,,,Expand disposal events for hazardous household waste
,,,,,Expand opportunities for electronic waste collection and disposal
,,,,,Other garbage collection and recycling requests
,,,,,Provide more frequent garbage or recycling pick-up
,,,,,Provide more frequent garbage or recycling pick-up for schools and institutions
,,,,,Provide more frequent organics/recycling collection service for schools and institutions
,,,,,Provide more on-street trash cans and recycling containers
,,,,,Provide or expand community composting programs
,,,,,Expand Curbside Composting
,,,,,Maintain replacement cycle for trucks and equipment
,,,,,Other garbage collection and recycling infrastructure requests
,,,,,Provide new or increase number of sanitation trucks and other equipment
,,,,,Provide new or upgrade existing sanitation garages or other sanitation infrastructure
,,,,,Increase number of surveillance cameras for illegal dumping
,,,,,Increase enforcement of alternate street parking cleaning rules
,,,,,Increase enforcement of canine waste laws
,,,,,Increase enforcement of dirty sidewalk/dirty area/failure to clean area laws
,,,,,Increase enforcement of failure to store receptacle laws
,,,,,Increase enforcement of illegal dumping laws
,,,,,Increase enforcement of illegal posting laws
,,,,,Increase enforcement of recycling laws
,,,,,Other enforcement requests
,,,,,Increase enforcement of street vending
,,,,,Increase enforcement of Set-out laws
,,,,,Improve snow removal
,,,,,Increase cleaning of dump-out/drop-off locations
,,,,,Increase vacant lot cleaning
,,,,,Other cleaning requests
,,,,,Provide more frequent litter basket collection
,,,,,Increase Highway/Ramp cleaning
,,,,,Increase Graffiti Removal/Cleaning
,,,,,Other capital budget request for DSNY
,,,,,Other expense budget request for DSNY
,,,,,Other zoning and land use requests
,,,,,Study land use and zoning to better match current use or future neighborhood needs
,,,,,Planning support for previously approved land use or zoning actions
,,,,,Planning support for capital investments
,,,,,"Increased community board training, including on core land use process and practices "
,,,,,"As needed Land use planning, technical and urban design support"
,,,,,Study land use and zoning to better provide for future neighborhood needs like affordable housing and job growth
,,,,, Create a neighborhood plan in coordination with the community
,,,,,Address illegal conversions and uses of buildings
,,,,,Assign additional building inspectors (including expanding training programs)
,,,,,Expand code enforcement
,,,,,Other capital budget request for DOB
,,,,,Other expense budget request for DOB
,,,,,"Provide, expand, or enhance loan programs to rehabilitate multiple dwelling buildings"
,,,,,Provide more housing for extremely low and low income households
,,,,,Provide more housing for medium income households
,,,,,Provide more housing for seniors
,,,,,"Provide more housing for special needs households, such as the formerly homeless"
,,,,,"Provide, expand, or enhance rental subsidies programs"
,,,,,"Provide, expand, or enhance community outreach on HPD programs and services"
,,,,,"Provide, expand, or enhance programs for homeowners and first-time homebuyers"
,,,,,"Provide, expand, or enhance programs for housing inspections to correct code violations"
,,,,,"Provide, expand, or enhance tenant protection programs"
,,,,,Other housing oversight and emergency housing programs
,,,,,"Provide, expand, or enhance emergency housing programs for households displaced by fires or City-issued vacate orders"
,,,,,Other capital budget request for HPD
,,,,,Other expense budget request for HPD
,,,,,Expand the Section 8 Program
,,,,,Other housing support requests
,,,,,Improve public housing maintenance and cleanliness
,,,,,"Other public housing maintenance, staffing and management requests"
,,,,,Create more housing on NYCHA properties
,,,,,Increase energy efficiency and environmental performance of NYCHA developments
,,,,,Install recycling facilities at NYCHA developments
,,,,,Install security cameras or make other safety upgrades
,,,,,Other public housing upgrades or renovations requests
,,,,,Renovate or upgrade NYCHA community facilities or open space
,,,,,Renovate or upgrade public housing developments
,,,,,Other capital budget request for NYCHA
,,,,,Other expense budget request for NYCHA
,,,,,Expand programming and activation of City-owned sites
,,,,,Improve city-owed NYC public markets
,,,,,Invest in capital projects to improve access to waterfront 
,,,,,Invest in infrastructure that will support growth in commercial business districts  
,,,,,Expand clean space initiatives for public sites and graffiti free removal program for private sites along commercial business corridors
,,,,,Other capital budget request for EDC
,,,,,"Build or expand affordable work or research lab spaces related to key industries, such as film/tv, advanced manufacturing, life science and healthcare, renewable energy and freight maritime"
,,,,,"Expand programs in emerging and legacy industries, e.g. fashion, film, advanced and food manufacturing, life sciences and healthcare, offshore wind, freight, and maritime"
,,,,,Expand programs to support MWBE-owned firms and businesses
,,,,,Other expense budget request for EDC
,,,,,"Invest in access to low cost financing and financial incentives to help businesses construct or improve space, job creation and retention, and catalyze new capital investment"
,,,,,Invest in financial incentives and low cost financing for job creation and retention
,,,,,Invest in planning for transportation-oriented infrastructure
,,,,,Assist with on-site business compliance with City regulations
,,,,,Other business regulatory assistance requests
,,,,,Provide or expand assistance to obtain licenses and permits
,,,,,Provide or expand business recovery assistance after an emergency
,,,,,Conduct a commercial district needs assessment
,,,,,Conduct BID Feasibility Analysis or support BID Formation Planning for a selected commercial district
,,,,,Other commercial district revitalization requests
,,,,,Support development of local Storefront / Facade Improvement Program
,,,,,"Support local CBO's efforts to improve a public space through management, maintenance and programming"
,,,,,"Support local CBO's efforts to provide or expand district marketing, branding, and promotion"
,,,,,Support local CBO's efforts to provide or expand retail attraction and retention assistance
,,,,,Support merchant organizing
,,,,,Support non-profit organizational development and capacity building
,,,,,Deploy Mobile Outreach Unit or Chamber On-the-Go to provide business services
,,,,,Help minority- and women-owned businesses grow their capacity
,,,,,"Increase certification support for minority-, women-owned, local and emerging businesses"
,,,,,"Provide assistance to minority-, women-owned businesses on contracting with the City"
,,,,,Provide commercial lease support for business owners
,,,,,Provide disaster and resiliency preparation for small businesses
,,,,,Provide information about incentive programs and energy savings
,,,,,"Provide information on how to sell to federal, state and City government"
,,,,,Provide or expand access to capital
,,,,,Provide or expand business education to businesses and entrepreneurs
,,,,,Support emerging entrepreneurs and new small businesses
,,,,,"Support immigrant, M/WBE, and veteran-owned businesses"
,,,,,"Support local, long-standing businesses"
,,,,,Support recruitment or hiring of employees
,,,,,Deploy Mobile Outreach Unit to provide workforce services
,,,,,Help job seekers connect to employment
,,,,,Other workforce development requests
,,,,,Provide or expand occupational skills training programs
,,,,,Other capital budget request for SBS
,,,,,Other expense budget request for SBS
,,,,,Expand the frequency or hours of Staten Island Ferry
,,,,,Address traffic congestion
,,,,,Conduct traffic or parking studies
,,,,,"Improve traffic and pedestrian safety, including traffic calming"
,,,,,Other traffic improvement requests
,,,,,Other expense budget request for DOT
,,,,,Add street signage or wayfinding elements
,,,,,"Improve mobility options, including bike share and car share"
,,,,,Install Real Time Passenger Information signs
,,,,,Install streetscape improvements
,,,,,Other transportation infrastructure requests
,,,,,Provide new bike lanes
,,,,,Provide new traffic or pedestrian signals
,,,,,Reconstruct streets
,,,,,Rehabilitate bridges
,,,,,Repair or build new seawalls or bulkheads
,,,,,Repair or build new step streets
,,,,,"Repair or construct sidewalks, curbs, or pedestrian ramps"
,,,,,"Repair or construct medians, or other street assets"
,,,,,Repair or provide new street lights
,,,,,"Roadway maintenance (resurfacing, trench restoration, etc.)"
,,,,,Upgrade or create new greenways
,,,,,Upgrade or create new plazas
,,,,,Upgrade or provide new Select Bus Service (SBS) routes
,,,,,Other capital budget request for DOT
,,,,,"Improve accessibility of transit infrastructure, by providing elevators, escalators, etc."
,,,,,Other transit infrastructure requests
,,,,,Repair or upgrade subway stations or other transit infrastructure
,,,,,Expand bus service frequency or hours of operation
,,,,,Expand subway service frequency or hours of operations
,,,,,"Improve bus cleanliness, safety or maintenance"
,,,,,"Improve subway station or train cleanliness, safety and maintenance"
,,,,,Other transit service requests
,,,,,Provide a new bus service or Select Bus Service
,,,,,Other capital budget request for NYCTA
,,,,,Other capital budget request for TLC
,,,,,Other expense budget request for TLC
