id,category,description
1,"Education, Child Welfare, and Youth","Providers of children and youth services and all schools, including higher education facilities"
2,"Parks, Gardens, and Historical Sites","Historic sites, recreational areas, parks, and nature preserves"
3,Libraries and Cultural Programs,Public Libraries and Cultural Institutions
4,"Public Safety, Emergency Services, and Administration of Justice","Police services, emergency response, courthouses, and correctional facilities"
5,Health and Human Services,"Health and social service providers, including hospitals, legal services, and homeless shelters"
6,Core Infrastructure and Transportation,"Train and bus yards, parking lots, solid waste processors, and wastewater treatment plants"
7,Administration of Government,"Sites owned or leased by the City for administration, operations, and maintenance"